{
  "project": "episode_demo",
  "series": "龙骨列车",
  "episode": "EP02",
  "active_run_id": "RUN-EP02-U08",
  "updated_at": "2026-09-20T15:21:51.143069+00:00",
  "runs": [
    {
      "run_id": "RUN-EP02-U01",
      "segment": "U01",
      "segment_title": "B-2A（物理格斗）",
      "status": "COMPLETED",
      "current_step": "runninghub-local-adapter",
      "pending_decision": "",
      "progress": {
        "completed": 6,
        "total": 6
      },
      "path": "runs/RUN-EP02-U01.json",
      "last_event_at": "2026-09-20T14:26:43.119617+00:00",
      "updated_at": "2026-09-20T14:26:43.131675+00:00"
    },
    {
      "run_id": "RUN-EP02-U02",
      "segment": "U02",
      "segment_title": "B-2B（近身压制）",
      "status": "COMPLETED",
      "current_step": "runninghub-local-adapter",
      "pending_decision": "",
      "progress": {
        "completed": 6,
        "total": 6
      },
      "path": "runs/RUN-EP02-U02.json",
      "last_event_at": "2026-09-20T14:26:43.260132+00:00",
      "updated_at": "2026-09-20T14:26:43.272889+00:00"
    },
    {
      "run_id": "RUN-EP02-U03",
      "segment": "U03",
      "segment_title": "B-3A（追逐）",
      "status": "COMPLETED",
      "current_step": "runninghub-local-adapter",
      "pending_decision": "",
      "progress": {
        "completed": 6,
        "total": 6
      },
      "path": "runs/RUN-EP02-U03.json",
      "last_event_at": "2026-09-20T14:26:43.409052+00:00",
      "updated_at": "2026-09-20T14:26:43.420765+00:00"
    },
    {
      "run_id": "RUN-EP02-U04",
      "segment": "U04",
      "segment_title": "B-3B（对峙）",
      "status": "COMPLETED",
      "current_step": "runninghub-local-adapter",
      "pending_decision": "",
      "progress": {
        "completed": 6,
        "total": 6
      },
      "path": "runs/RUN-EP02-U04.json",
      "last_event_at": "2026-09-20T14:26:43.572775+00:00",
      "updated_at": "2026-09-20T14:26:43.585425+00:00"
    },
    {
      "run_id": "RUN-EP02-U05",
      "segment": "U05",
      "segment_title": "B-3C（反击）",
      "status": "PAUSED_EXCEPTION",
      "current_step": "short-drama-production-qa",
      "pending_decision": "第 2 格角色手部结构异常，判定 FAIL",
      "progress": {
        "completed": 4,
        "total": 6
      },
      "path": "runs/RUN-EP02-U05.json",
      "last_event_at": "2026-09-20T14:26:43.725488+00:00",
      "updated_at": "2026-09-20T14:26:43.737764+00:00"
    },
    {
      "run_id": "RUN-EP02-U06",
      "segment": "U06",
      "segment_title": "B-3D（人物躲避爆炸）",
      "status": "RUNNING",
      "current_step": "short-drama-script-breakdown",
      "pending_decision": "",
      "progress": {
        "completed": 1,
        "total": 6
      },
      "path": "runs/RUN-EP02-U06.json",
      "last_event_at": "2026-09-20T14:26:43.795224+00:00",
      "updated_at": "2026-09-20T14:26:43.807355+00:00"
    },
    {
      "run_id": "RUN-EP02-U07",
      "segment": "U07",
      "segment_title": "（待拆解）",
      "status": "RUNNING",
      "current_step": "short-drama-script-breakdown",
      "pending_decision": "",
      "progress": {
        "completed": 1,
        "total": 6
      },
      "path": "runs/RUN-EP02-U07.json",
      "last_event_at": "2026-09-20T23:10:52+08:00",
      "updated_at": "2026-09-20T15:10:52.210946+00:00"
    },
    {
      "run_id": "RUN-EP02-U08",
      "segment": "U08",
      "segment_title": "（待拆解）",
      "status": "RUNNING",
      "current_step": "short-drama-script-breakdown",
      "pending_decision": "",
      "progress": {
        "completed": 1,
        "total": 6
      },
      "path": "runs/RUN-EP02-U08.json",
      "last_event_at": "2026-09-20T23:21:51+08:00",
      "updated_at": "2026-09-20T15:21:51.142067+00:00"
    },
    {
      "run_id": "RUN-EP02-U09",
      "segment": "U09",
      "segment_title": "（待拆解）",
      "status": "RUNNING",
      "current_step": "short-drama-production-router",
      "pending_decision": "",
      "progress": {
        "completed": 0,
        "total": 6
      },
      "path": "runs/RUN-EP02-U09.json",
      "last_event_at": "",
      "updated_at": "2026-09-20T14:26:43.946883+00:00"
    },
    {
      "run_id": "RUN-EP02-U10",
      "segment": "U10",
      "segment_title": "（待拆解）",
      "status": "RUNNING",
      "current_step": "short-drama-production-router",
      "pending_decision": "",
      "progress": {
        "completed": 0,
        "total": 6
      },
      "path": "runs/RUN-EP02-U10.json",
      "last_event_at": "",
      "updated_at": "2026-09-20T14:26:44.002776+00:00"
    },
    {
      "run_id": "RUN-EP02-U11",
      "segment": "U11",
      "segment_title": "（待拆解）",
      "status": "RUNNING",
      "current_step": "short-drama-production-router",
      "pending_decision": "",
      "progress": {
        "completed": 0,
        "total": 6
      },
      "path": "runs/RUN-EP02-U11.json",
      "last_event_at": "",
      "updated_at": "2026-09-20T14:26:44.055429+00:00"
    },
    {
      "run_id": "RUN-EP02-U12",
      "segment": "U12",
      "segment_title": "（待拆解）",
      "status": "RUNNING",
      "current_step": "short-drama-production-router",
      "pending_decision": "",
      "progress": {
        "completed": 0,
        "total": 6
      },
      "path": "runs/RUN-EP02-U12.json",
      "last_event_at": "",
      "updated_at": "2026-09-20T14:26:44.113301+00:00"
    },
    {
      "run_id": "RUN-EP02-U13",
      "segment": "U13",
      "segment_title": "（待拆解）",
      "status": "RUNNING",
      "current_step": "short-drama-production-router",
      "pending_decision": "",
      "progress": {
        "completed": 0,
        "total": 6
      },
      "path": "runs/RUN-EP02-U13.json",
      "last_event_at": "",
      "updated_at": "2026-09-20T14:26:44.162886+00:00"
    },
    {
      "run_id": "RUN-EP02-U14",
      "segment": "U14",
      "segment_title": "（待拆解）",
      "status": "RUNNING",
      "current_step": "short-drama-production-router",
      "pending_decision": "",
      "progress": {
        "completed": 0,
        "total": 6
      },
      "path": "runs/RUN-EP02-U14.json",
      "last_event_at": "",
      "updated_at": "2026-09-20T14:26:44.223072+00:00"
    },
    {
      "run_id": "RUN-EP02-U15",
      "segment": "U15",
      "segment_title": "（待拆解）",
      "status": "RUNNING",
      "current_step": "short-drama-production-router",
      "pending_decision": "",
      "progress": {
        "completed": 0,
        "total": 6
      },
      "path": "runs/RUN-EP02-U15.json",
      "last_event_at": "",
      "updated_at": "2026-09-20T14:26:44.279276+00:00"
    },
    {
      "run_id": "RUN-EP02-U16",
      "segment": "U16",
      "segment_title": "（待拆解）",
      "status": "RUNNING",
      "current_step": "short-drama-production-router",
      "pending_decision": "",
      "progress": {
        "completed": 0,
        "total": 6
      },
      "path": "runs/RUN-EP02-U16.json",
      "last_event_at": "",
      "updated_at": "2026-09-20T14:26:44.345272+00:00"
    },
    {
      "run_id": "RUN-EP02-U17",
      "segment": "U17",
      "segment_title": "（待拆解）",
      "status": "RUNNING",
      "current_step": "short-drama-production-router",
      "pending_decision": "",
      "progress": {
        "completed": 0,
        "total": 6
      },
      "path": "runs/RUN-EP02-U17.json",
      "last_event_at": "",
      "updated_at": "2026-09-20T14:26:44.396180+00:00"
    },
    {
      "run_id": "RUN-EP02-U18",
      "segment": "U18",
      "segment_title": "（待拆解）",
      "status": "RUNNING",
      "current_step": "short-drama-production-router",
      "pending_decision": "",
      "progress": {
        "completed": 0,
        "total": 6
      },
      "path": "runs/RUN-EP02-U18.json",
      "last_event_at": "",
      "updated_at": "2026-09-20T14:26:44.466871+00:00"
    },
    {
      "run_id": "RUN-EP02-U19",
      "segment": "U19",
      "segment_title": "（待拆解）",
      "status": "RUNNING",
      "current_step": "short-drama-production-router",
      "pending_decision": "",
      "progress": {
        "completed": 0,
        "total": 6
      },
      "path": "runs/RUN-EP02-U19.json",
      "last_event_at": "",
      "updated_at": "2026-09-20T14:26:44.527383+00:00"
    },
    {
      "run_id": "RUN-EP02-U20",
      "segment": "U20",
      "segment_title": "（待拆解）",
      "status": "RUNNING",
      "current_step": "short-drama-production-router",
      "pending_decision": "",
      "progress": {
        "completed": 0,
        "total": 6
      },
      "path": "runs/RUN-EP02-U20.json",
      "last_event_at": "",
      "updated_at": "2026-09-20T14:26:44.588631+00:00"
    }
  ]
}